<?xml version="1.0" encoding="UTF-8"?>
<!DOCTYPE Profile_Category SYSTEM "Profile_Category.dtd">
<Profile_Category Name="me_mission">
  <Database_Name>default</Database_Name>
  <Timestamp>1535347389</Timestamp>
  <Profile_ID>11</Profile_ID>
  <Profile_Instance Folder_Name="\Scenario Specific\Airport Sample" Name="Air defense">me_mission/Air defense.me_mission</Profile_Instance>
  <Profile_Instance Folder_Name="\Scenario Specific\Airport Sample" Name="Air to Air">me_mission/Air to Air.me_mission</Profile_Instance>
  <Profile_Instance Folder_Name="\Scenario Specific\Airport Sample" Name="Air to Ground">me_mission/Air to Ground.me_mission</Profile_Instance>
  <Profile_Instance Folder_Name="\Scenario Specific\Airport Sample" Name="EscortMission 1">me_mission/EscortMission 1.me_mission</Profile_Instance>
  <Profile_Instance Folder_Name="\Scenario Specific\Airport Sample" Name="EscortMission 2">me_mission/EscortMission 2.me_mission</Profile_Instance>
  <Profile_Instance Folder_Name="\Scenario Specific\Airport Sample" Name="LeopardMission">me_mission/LeopardMission.me_mission</Profile_Instance>
  <Profile_Instance Folder_Name="\Scenario Specific\Airport Sample" Name="MasterMission">me_mission/MasterMission.me_mission</Profile_Instance>
  <Profile_Instance Folder_Name="\Scenario Specific\Airport Sample" Name="MigMission">me_mission/MigMission.me_mission</Profile_Instance>
  <Profile_Instance Folder_Name="\Scenario Specific\Airport Sample" Name="RescuedSoldierMission">me_mission/RescuedSoldierMission.me_mission</Profile_Instance>
  <Profile_Instance Folder_Name="\Scenario Specific\Airport Sample" Name="SoldierMission">me_mission/SoldierMission.me_mission</Profile_Instance>
  <Profile_Instance Folder_Name="\Scenario Specific\Bombing Sample" Name="Blue Fighter">me_mission/Blue Fighter.me_mission</Profile_Instance>
  <Profile_Instance Folder_Name="\Scenario Specific\Bombing Sample" Name="Blue Soldier">me_mission/Blue Soldier.me_mission</Profile_Instance>
  <Profile_Instance Folder_Name="\Scenario Specific\Bombing Sample" Name="Red Tank">me_mission/Red Tank.me_mission</Profile_Instance>
  <Profile_Instance Folder_Name="\Scenario Specific\CAP Air Sample" Name="CAP Awacs">me_mission/CAP Awacs.me_mission</Profile_Instance>
  <Profile_Instance Folder_Name="\Scenario Specific\CAP Air Sample" Name="CAP Leader">me_mission/CAP Leader.me_mission</Profile_Instance>
  <Profile_Instance Folder_Name="\Scenario Specific\CAP Air Sample" Name="CAP Wingman">me_mission/CAP Wingman.me_mission</Profile_Instance>
  <Profile_Instance Folder_Name="\Scenario Specific\DI-Guy Sample" Name="DI-Guy Demo Insurgent">me_mission/DI-Guy Demo Insurgent.me_mission</Profile_Instance>
  <Profile_Instance Folder_Name="\Scenario Specific\DI-Guy Sample" Name="DI-Guy Demo Sergeant">me_mission/DI-Guy Demo Sergeant.me_mission</Profile_Instance>
  <Profile_Instance Folder_Name="\Scenario Specific\DI-Guy Sample" Name="DI-Guy Demo Soldier">me_mission/DI-Guy Demo Soldier.me_mission</Profile_Instance>
  <Profile_Instance Folder_Name="\Scenario Specific\Ground Sample" Name="Ground Demo Escort Helo">me_mission/Ground Demo Escort Helo.me_mission</Profile_Instance>
  <Profile_Instance Folder_Name="\Scenario Specific\Ground Sample" Name="Ground Demo Tank">me_mission/Ground Demo Tank.me_mission</Profile_Instance>
  <Profile_Instance Folder_Name="\Scenario Specific\Ground_Air_Defense" Name="Hind_defensse">me_mission/Hind_defensse.me_mission</Profile_Instance>
  <Profile_Instance Folder_Name="\Scenario Specific\Ground_Air_Defense" Name="ManPAD Observer">me_mission/ManPAD Observer.me_mission</Profile_Instance>
  <Profile_Instance Folder_Name="\Scenario Specific\Ground_Air_Defense" Name="ManPAD_Gunner">me_mission/ManPAD_Gunner.me_mission</Profile_Instance>
  <Profile_Instance Folder_Name="\Scenario Specific\Ground_Air_Defense" Name="ManPad Commander">me_mission/ManPad Commander.me_mission</Profile_Instance>
  <Profile_Instance Folder_Name="\Scenario Specific\Ground_Air_Defense" Name="Man_Unit">me_mission/Man_Unit.me_mission</Profile_Instance>
  <Profile_Instance Folder_Name="\Scenario Specific\Surface Sample" Name="Surf Demo Arleigh Burke">me_mission/Surf Demo Arleigh Burke.me_mission</Profile_Instance>
  <Profile_Instance Folder_Name="\Scenario Specific\Surface Sample" Name="Surf Demo Submarine">me_mission/Surf Demo Submarine.me_mission</Profile_Instance>
  <Profile_Instance Folder_Name="\Scenario Specific\UAS LGB Sample" Name="CNC">me_mission/CNC.me_mission</Profile_Instance>
  <Profile_Instance Folder_Name="\Scenario Specific\UAS LGB Sample" Name="ForwardObserver">me_mission/ForwardObserver.me_mission</Profile_Instance>
  <Profile_Instance Folder_Name="\Scenario Specific\UAS LGB Sample" Name="MQ9">me_mission/MQ9.me_mission</Profile_Instance>
  <Profile_Instance Name="Bomber">me_mission/Bomber.me_mission</Profile_Instance>
  <Profile_Instance Name="Civilian Wander">me_mission/Civilian Wander.me_mission</Profile_Instance>
  <Profile_Instance Name="EmbarkedSoldier">me_mission/EmbarkedSoldier.me_mission</Profile_Instance>
  <Profile_Instance Name="Enemy1">me_mission/Enemy1.me_mission</Profile_Instance>
  <Profile_Instance Name="Enemy2">me_mission/Enemy2.me_mission</Profile_Instance>
  <Profile_Instance Name="Friend1">me_mission/Friend1.me_mission</Profile_Instance>
  <Profile_Instance Name="Friend2">me_mission/Friend2.me_mission</Profile_Instance>
  <Profile_Instance Name="KillEnemy">me_mission/KillEnemy.me_mission</Profile_Instance>
  <Profile_Instance Name="QRFTask">me_mission/QRFTask.me_mission</Profile_Instance>
  <Profile_Instance Name="Traffic">me_mission/Traffic.me_mission</Profile_Instance>
</Profile_Category>
