<?xml version="1.0" encoding="UTF-8"?>
<!DOCTYPE Profile_Category SYSTEM "Profile_Category.dtd">
<Profile_Category Name="art_part">
  <Database_Name>default</Database_Name>
  <Timestamp>1481657862</Timestamp>
  <Profile_ID>3</Profile_ID>
  <Profile_Instance Name="Turret IFV">art_part/Turret IFV.art_part</Profile_Instance>
  <Profile_Instance Name="Turret MBT">art_part/Turret MBT.art_part</Profile_Instance>
  <Profile_Instance Name="Turret MG">art_part/Turret MG.art_part</Profile_Instance>
  <Profile_Instance Name="Turret TOW">art_part/Turret TOW.art_part</Profile_Instance>
</Profile_Category>
